{
 "$schema": "./tests/a11y/manual-review.schema.json",
 "schema_version": "1.0",
 "about": "Manual review of web UI v2 (docs/dev/accessibility.md, Manual review). Fill in fill_in per session and result per check: true = holds, false = fails (give issue), null + reason = not applicable, null without reason = not done yet. Do not change the other fields.",
 "generated_from": {
  "commit": "5885ea322d17",
  "ekte_version": "0.30.0",
  "tests_run_at": "2026-10-31T00:04:43+00:00"
 },
 "setup": "Run ekte serve and open http://127.0.0.1:8000/. Run one audit so that History, Analytics and a report exist, and add one monitor. Use the UI language and theme the session names unless a check names another.",
 "sessions": {
  "desktop-browser": {
   "setup": {
    "label": "Desktop browser, keyboard and mouse, no screen reader",
    "assistive_technology": null,
    "browser": "Chrome or another Chromium browser (for the DevTools rendering emulations)",
    "os": "Windows, macOS or Linux",
    "input": "keyboard and mouse",
    "language": "en",
    "theme": "light"
   },
   "fill_in": {
    "by": null,
    "date": null,
    "ekte_version": null,
    "at_version": null,
    "browser_version": null,
    "os_version": null
   }
  },
  "nvda-firefox": {
   "setup": {
    "label": "NVDA with Firefox on Windows",
    "assistive_technology": "NVDA",
    "browser": "Firefox",
    "os": "Windows",
    "input": "keyboard",
    "language": "en",
    "theme": "light"
   },
   "fill_in": {
    "by": null,
    "date": null,
    "ekte_version": null,
    "at_version": null,
    "browser_version": null,
    "os_version": null
   }
  },
  "voiceover-safari": {
   "setup": {
    "label": "VoiceOver with Safari on macOS",
    "assistive_technology": "VoiceOver (macOS)",
    "browser": "Safari",
    "os": "macOS",
    "input": "keyboard",
    "language": "en",
    "theme": "light"
   },
   "fill_in": {
    "by": null,
    "date": null,
    "ekte_version": null,
    "at_version": null,
    "browser_version": null,
    "os_version": null
   }
  },
  "touch": {
   "setup": {
    "label": "Phone or tablet with a touch screen",
    "assistive_technology": "VoiceOver (iOS) or TalkBack (Android)",
    "browser": "Safari (iOS) or Chrome (Android)",
    "os": "iOS or Android",
    "input": "touch",
    "language": "en",
    "theme": "light"
   },
   "fill_in": {
    "by": null,
    "date": null,
    "ekte_version": null,
    "at_version": null,
    "browser_version": null,
    "os_version": null
   }
  }
 },
 "checks": [
  {
   "id": "9.1.4.1/audit/desktop-browser/greyscale",
   "step": "9.1.4.1",
   "title": "Use of Color",
   "page": "audit",
   "url": "http://127.0.0.1:8000/",
   "session": "desktop-browser",
   "tools": [
    "Chromium DevTools: Rendering, Emulate vision deficiencies: Achromatopsia"
   ],
   "do": "Emulate greyscale and look at every status, badge, trend, chart series and highlighted item.",
   "expect": "Each state is still told apart by text, icon, pattern or position.",
   "result": null,
   "reason": null,
   "issue": null,
   "notes": null
  },
  {
   "id": "9.1.4.1/history/desktop-browser/greyscale",
   "step": "9.1.4.1",
   "title": "Use of Color",
   "page": "history",
   "url": "http://127.0.0.1:8000/history",
   "session": "desktop-browser",
   "tools": [
    "Chromium DevTools: Rendering, Emulate vision deficiencies: Achromatopsia"
   ],
   "do": "Emulate greyscale and look at every status, badge, trend, chart series and highlighted item.",
   "expect": "Each state is still told apart by text, icon, pattern or position.",
   "result": null,
   "reason": null,
   "issue": null,
   "notes": null
  },
  {
   "id": "9.1.4.1/monitors/desktop-browser/greyscale",
   "step": "9.1.4.1",
   "title": "Use of Color",
   "page": "monitors",
   "url": "http://127.0.0.1:8000/watches",
   "session": "desktop-browser",
   "tools": [
    "Chromium DevTools: Rendering, Emulate vision deficiencies: Achromatopsia"
   ],
   "do": "Emulate greyscale and look at every status, badge, trend, chart series and highlighted item.",
   "expect": "Each state is still told apart by text, icon, pattern or position.",
   "result": null,
   "reason": null,
   "issue": null,
   "notes": null
  },
  {
   "id": "9.1.4.1/kb/desktop-browser/greyscale",
   "step": "9.1.4.1",
   "title": "Use of Color",
   "page": "kb",
   "url": "http://127.0.0.1:8000/kb",
   "session": "desktop-browser",
   "tools": [
    "Chromium DevTools: Rendering, Emulate vision deficiencies: Achromatopsia"
   ],
   "do": "Emulate greyscale and look at every status, badge, trend, chart series and highlighted item.",
   "expect": "Each state is still told apart by text, icon, pattern or position.",
   "result": null,
   "reason": null,
   "issue": null,
   "notes": null
  },
  {
   "id": "9.1.4.1/analytics/desktop-browser/greyscale",
   "step": "9.1.4.1",
   "title": "Use of Color",
   "page": "analytics",
   "url": "http://127.0.0.1:8000/analytics",
   "session": "desktop-browser",
   "tools": [
    "Chromium DevTools: Rendering, Emulate vision deficiencies: Achromatopsia"
   ],
   "do": "Emulate greyscale and look at every status, badge, trend, chart series and highlighted item.",
   "expect": "Each state is still told apart by text, icon, pattern or position.",
   "result": null,
   "reason": null,
   "issue": null,
   "notes": null
  },
  {
   "id": "9.1.4.1/accessibility/desktop-browser/greyscale",
   "step": "9.1.4.1",
   "title": "Use of Color",
   "page": "accessibility",
   "url": "http://127.0.0.1:8000/accessibility",
   "session": "desktop-browser",
   "tools": [
    "Chromium DevTools: Rendering, Emulate vision deficiencies: Achromatopsia"
   ],
   "do": "Emulate greyscale and look at every status, badge, trend, chart series and highlighted item.",
   "expect": "Each state is still told apart by text, icon, pattern or position.",
   "result": null,
   "reason": null,
   "issue": null,
   "notes": null
  },
  {
   "id": "9.1.4.11/audit/desktop-browser/graphics-contrast-light",
   "step": "9.1.4.11",
   "title": "Non-text Contrast",
   "page": "audit",
   "url": "http://127.0.0.1:8000/",
   "session": "desktop-browser",
   "theme": "light",
   "tools": [
    "DevTools colour picker or the Colour Contrast Analyser"
   ],
   "do": "Measure each chart series, bar, meter, marker and informative icon against its neighbours and the background.",
   "expect": "Each reaches 3:1, or the same information is in adjacent text or a data table.",
   "result": null,
   "reason": null,
   "issue": null,
   "notes": null
  },
  {
   "id": "9.1.4.11/history/desktop-browser/graphics-contrast-light",
   "step": "9.1.4.11",
   "title": "Non-text Contrast",
   "page": "history",
   "url": "http://127.0.0.1:8000/history",
   "session": "desktop-browser",
   "theme": "light",
   "tools": [
    "DevTools colour picker or the Colour Contrast Analyser"
   ],
   "do": "Measure each chart series, bar, meter, marker and informative icon against its neighbours and the background.",
   "expect": "Each reaches 3:1, or the same information is in adjacent text or a data table.",
   "result": null,
   "reason": null,
   "issue": null,
   "notes": null
  },
  {
   "id": "9.1.4.11/analytics/desktop-browser/graphics-contrast-light",
   "step": "9.1.4.11",
   "title": "Non-text Contrast",
   "page": "analytics",
   "url": "http://127.0.0.1:8000/analytics",
   "session": "desktop-browser",
   "theme": "light",
   "tools": [
    "DevTools colour picker or the Colour Contrast Analyser"
   ],
   "do": "Measure each chart series, bar, meter, marker and informative icon against its neighbours and the background.",
   "expect": "Each reaches 3:1, or the same information is in adjacent text or a data table.",
   "result": null,
   "reason": null,
   "issue": null,
   "notes": null
  },
  {
   "id": "9.1.4.11/accessibility/desktop-browser/graphics-contrast-light",
   "step": "9.1.4.11",
   "title": "Non-text Contrast",
   "page": "accessibility",
   "url": "http://127.0.0.1:8000/accessibility",
   "session": "desktop-browser",
   "theme": "light",
   "tools": [
    "DevTools colour picker or the Colour Contrast Analyser"
   ],
   "do": "Measure each chart series, bar, meter, marker and informative icon against its neighbours and the background.",
   "expect": "Each reaches 3:1, or the same information is in adjacent text or a data table.",
   "result": null,
   "reason": null,
   "issue": null,
   "notes": null
  },
  {
   "id": "9.1.4.11/audit/desktop-browser/graphics-contrast-dark",
   "step": "9.1.4.11",
   "title": "Non-text Contrast",
   "page": "audit",
   "url": "http://127.0.0.1:8000/",
   "session": "desktop-browser",
   "theme": "dark",
   "tools": [
    "DevTools colour picker or the Colour Contrast Analyser"
   ],
   "do": "In the dark theme, measure each chart series, bar, meter, marker and informative icon against its neighbours and the background.",
   "expect": "Each reaches 3:1, or the same information is in adjacent text or a data table.",
   "result": null,
   "reason": null,
   "issue": null,
   "notes": null
  },
  {
   "id": "9.1.4.11/history/desktop-browser/graphics-contrast-dark",
   "step": "9.1.4.11",
   "title": "Non-text Contrast",
   "page": "history",
   "url": "http://127.0.0.1:8000/history",
   "session": "desktop-browser",
   "theme": "dark",
   "tools": [
    "DevTools colour picker or the Colour Contrast Analyser"
   ],
   "do": "In the dark theme, measure each chart series, bar, meter, marker and informative icon against its neighbours and the background.",
   "expect": "Each reaches 3:1, or the same information is in adjacent text or a data table.",
   "result": null,
   "reason": null,
   "issue": null,
   "notes": null
  },
  {
   "id": "9.1.4.11/analytics/desktop-browser/graphics-contrast-dark",
   "step": "9.1.4.11",
   "title": "Non-text Contrast",
   "page": "analytics",
   "url": "http://127.0.0.1:8000/analytics",
   "session": "desktop-browser",
   "theme": "dark",
   "tools": [